price,surface,piece,rooms,bathroom,address,description,more_features_1_dict,more_features_2_dict
850 000 DH,52 m²,2 Salles de bains,,,Oulfa à Casablanca,"Local commercial ou bureau à vendre à oulfa / casa
Local commercial ou bureau à vendre, au quartier oulfa à 50m du debut du bd Sebou, proche du nouveau site CFC casa finance city, d'une superficie globale de 52m2, le local est au RDC avec 2 façades, et séparé en 2 locaux mitoyens de 25m2 et 27m2, 2 salles d'eau dont une avec toilettes turc et la pré-installation de chauffe eau, pouvant accueillir 2 activités distinctes, les portes intérieures sont vitrées en aluminium, celles de l'extérieur en fer accordéon 8 panneaux de forte épaisseur.
Je reste à votre disposition pour plus d'informations.","{'Type de bien\nLocal commercial': 'Type de bien\nLocal commercial', 'Etat\nBon état': 'Etat\nBon état', 'Etat du bien\n5-10 ans': 'Etat du bien\n5-10 ans', 'Type du sol\nParquet': 'Type du sol\nParquet'}","{'Double vitrage': 'Double vitrage', 'Porte blindée': 'Porte blindée'}"
Prix à consulter,202 m²,5 Pièces,3 Chambres,3 Salles de bains,Maârif à Casablanca,"Villa à vendre
Villa de 202 m parfaite pour rénovation ou pour un nouveau projet d'immeuble de standing de 5 étages","{'Type de bien\nVilla': 'Type de bien\nVilla', 'Etat\nÀ rénover': 'Etat\nÀ rénover', 'Etat du bien\n20-30 ans': 'Etat du bien\n20-30 ans'}",{}
2 197 000 DH,169 m²,1 Salle de bain,,,Sidi Maarouf à Casablanca,"Vente de bureau a sidi maarouf
Plateau bureau à vendre a sidi maarouf à proximité de casanearshore et a 2 min de l’hotel onomo, sur le grand boulevard zoulikha nasri à côté de l’hôtel onomo avec deux places de parking titré
Plusieurs superficies disponibles
si vous avez d’autres question n’hésitez pas à nous contacter.","{'Type de bien\nBureau': 'Type de bien\nBureau', 'Etat\nNouveau': 'Etat\nNouveau', ""Etat du bien\nMoins d'un an"": ""Etat du bien\nMoins d'un an"", 'Étage du bien\n5ème': 'Étage du bien\n5ème', 'Type du sol\nCarrelage': 'Type du sol\nCarrelage'}","{'Garage': 'Garage', 'Ascenseur': 'Ascenseur', 'Concierge': 'Concierge', 'Climatisation': 'Climatisation', 'Chauffage central': 'Chauffage central', 'Sécurité': 'Sécurité', 'Double vitrage': 'Double vitrage'}"
Prix à consulter,80 m²,2 Pièces,2 Chambres,2 Salles de bains,Oulfa à Casablanca,"Je mets en vente mon appartement très bon état
Résidence fermée et sécurisée avec ascenseur et parking sous-sol. Près de toutes commodités. Écoles supermarché busway....","{'Type de bien\nAppartement': 'Type de bien\nAppartement', 'Etat\nBon état': 'Etat\nBon état', 'Etat du bien\n5-10 ans': 'Etat du bien\n5-10 ans', 'Étage du bien\n3ème': 'Étage du bien\n3ème', 'Orientation\nEst': 'Orientation\nEst', 'Type du sol\nMarbre': 'Type du sol\nMarbre'}","{'Jardin': 'Jardin', 'Garage': 'Garage', 'Ascenseur': 'Ascenseur', 'Concierge': 'Concierge', 'Façade extérieure': 'Façade extérieure', 'Salon Marocain': 'Salon Marocain', 'Antenne parabolique': 'Antenne parabolique', 'Sécurité': 'Sécurité', 'Cuisine équipée': 'Cuisine équipée', 'Four': 'Four'}"
650 000 DH,100 m²,4 Pièces,2 Chambres,2 Salles de bains,Derb Salama à Casablanca,"Superb Maison à Saisir / منزل رائع
Maison à vendre à Ben M'sick.
1ere Etage le Haut
Superficie:
60m² 1ere Étage
40m² 2éme Étage
18m² Terrasse

Occasion à saisir pour cette maison à vendre.
Porte individuelle, 2 chambres à coucher, 2 salles de bains. 4 pièces lumineuses.

Bien entretenu dans un super emplacement à casa
À proximité: Ecoles, Souk, Hôpital, Transport …

N’hésitez pas à me contacter pour plus d’info ou visite

////////////////////////////

دار نقية و مصلوحة فموقع زوين
بيوت، 2 صالونات، 2 مراحات،كوزينة و حمام و 2 طواليط، سطح ديالك 2
كلشي قريب، السوق المستشفى المدارس المركوب
مرحبا","{'Type de bien\nMaison': 'Type de bien\nMaison', 'Etat\nBon état': 'Etat\nBon état'}","{'Terrasse': 'Terrasse', 'Salon Marocain': 'Salon Marocain'}"
830 000 DH,76 m²,3 Pièces,2 Chambres,1 Salle de bain,Belvédère à Casablanca,"Bel appart a belvedere
Bonjour, on met en vente cet bel appart proche des commodités écoles et marchés. Le prix est légérement négociable.","{'Type de bien\nAppartement': 'Type de bien\nAppartement', 'Etat\nBon état': 'Etat\nBon état', 'Etat du bien\n10-20 ans': 'Etat du bien\n10-20 ans', 'Étage du bien\n4ème': 'Étage du bien\n4ème', 'Orientation\nEst': 'Orientation\nEst', 'Type du sol\nCarrelage': 'Type du sol\nCarrelage'}","{'Garage': 'Garage', 'Ascenseur': 'Ascenseur', 'Concierge': 'Concierge', 'Antenne parabolique': 'Antenne parabolique', 'Sécurité': 'Sécurité'}"
2 900 000 DH,92 m²,1 Salle de bain,,,Racine à Casablanca,"Local commercial à vendre
Local commercial à vendre 100 mq 20 mq supporte
5 rideaux 2 face à bourgogne centre casa","{'Type de bien\nLocal commercial': 'Type de bien\nLocal commercial', 'Etat\nBon état': 'Etat\nBon état', 'Etat du bien\n10-20 ans': 'Etat du bien\n10-20 ans', 'Étage du bien\n1er': 'Étage du bien\n1er', 'Type du sol\nMarbre': 'Type du sol\nMarbre'}","{'Garage': 'Garage', 'Climatisation': 'Climatisation'}"
1 500 000 DH,123 m²,3 Pièces,2 Chambres,2 Salles de bains,Derb Ghalef à Casablanca,"Bel apt de 123m à vendre quartier Derb Ghalef
Vous recherchez un nouveau chez-vous spacieux et lumineux, Ne cherchez plus, Cet appartement de 123m², situé dans le quartier recherché est la perle rare que vous attendiez.
Surface totale : 123m², 2 chambres à coucher avec la possibilité de faire une 3 -ème, 1 salle de bain, 1 salle d’eau, Cuisine, Salon spacieux et lumineux, Balcon offrant une vue sur le Bd Abdelmoumen, Placards intégrés pour un rangement optimal, Parking
Situé à proximité de transports en commun, commerces, cet appartement offre un cadre de vie idéal pour les familles, les professionnels ou les investisseurs","{'Type de bien\nAppartement': 'Type de bien\nAppartement', 'Etat\nBon état': 'Etat\nBon état', 'Etat du bien\n10-20 ans': 'Etat du bien\n10-20 ans', 'Étage du bien\n2ème': 'Étage du bien\n2ème', 'Orientation\nOuest': 'Orientation\nOuest', 'Type du sol\nCarrelage': 'Type du sol\nCarrelage'}","{'Garage': 'Garage', 'Ascenseur': 'Ascenseur', 'Concierge': 'Concierge', 'Façade extérieure': 'Façade extérieure', 'Salon Marocain': 'Salon Marocain', 'Salon européen': 'Salon européen'}"
3 300 000 DH,83 m²,1 Salle de bain,,,Bourgogne Ouest à Casablanca,"Local commercial à vendre
Local commercial à vendre, très bon emplacement sur le boulevard de bordeaux, proche du boulevard Zerktouni. Surface : 83 m2 dont environ 30m2 de sous-pente avec bonne hauteur de plafond. Prix négociable.","{'Type de bien\nLocal commercial': 'Type de bien\nLocal commercial', 'Etat\nBon état': 'Etat\nBon état', 'Etat du bien\n20-30 ans': 'Etat du bien\n20-30 ans', 'Type du sol\nCarrelage': 'Type du sol\nCarrelage'}",{}
Prix à consulter,99 m²,2 Pièces,2 Chambres,2 Salles de bains,Beausite à Casablanca,"Appartement à l'achat à Beausite. Surface totale 99 m². Belle terrasse et jardin
Appartement idéal à la vente. 2 pièces, 2 salles de bains . séjour.la cours, 99 m². 1ère étage. Moins de 2 ans. Revêtement: Carrelage.

Venez découvrir cet appartement à vendre à firdaous ain sbaa Les extérieurs se composent d'un jardin et d'une terrasse. Concierge.

Contactez-nous pour visiter cet appartement à vendre à Casablanca. Résidence sécurisée. Isolation sonore avec double vitrage. Cuisine bien équipée.","{'Type de bien\nAppartement': 'Type de bien\nAppartement', 'Etat\nBon état': 'Etat\nBon état', 'Etat du bien\n1-5 ans': 'Etat du bien\n1-5 ans', 'Étage du bien\n20ème': 'Étage du bien\n20ème', 'Type du sol\nCarrelage': 'Type du sol\nCarrelage'}","{'Jardin': 'Jardin', 'Terrasse': 'Terrasse', 'Concierge': 'Concierge', 'Chambre rangement': 'Chambre rangement', 'Sécurité': 'Sécurité', 'Double vitrage': 'Double vitrage', 'Cuisine équipée': 'Cuisine équipée'}"
600 000 DH,70 m²,3 Pièces,1 Chambre,1 Salle de bain,Sidi Othmane à Casablanca,"Superbe appartement à vendre à Sidi Othmane. 3 grandes pièces.
Terrain avec sous-sol vendu et trois étages non construits à vendre","{'Type de bien\nAppartement': 'Type de bien\nAppartement', 'Etat\nNouveau': 'Etat\nNouveau', ""Etat du bien\nMoins d'un an"": ""Etat du bien\nMoins d'un an"", 'Orientation\nOuest': 'Orientation\nOuest', 'Type du sol\nCarrelage': 'Type du sol\nCarrelage'}",{}
1 998 000 DH,111 m²,2 Pièces,2 Chambres,2 Salles de bains,Bourgogne Ouest à Casablanca,"Superbe appartement à vendre à Bourgogne Ouest. 2 pièces. Concierge et climatisation
Faites une belle affaire en achetant cet appartement. Prix 1 998 000 DH. 2 pièces, 2 salles de bains privatives, 111 m². 2 chambres. 2ème étage. Moins de 5 ans. Résidence sécurisée. Le bien dispose également d'un beau salon marocain traditionnel.

Cet appartement est proposé à la vente à Bourgogne Ouest. Appréciez le confort de la climatisation. La résidence dispose également d'un service de concierge. Espaces verts et ascenseur.

Programmez dès maintenant votre visite pour cet appartement d'exception à Casablanca. Cuisine équipée. Four. Micro-ondes.","{'Type de bien\nAppartement': 'Type de bien\nAppartement', 'Etat\nNouveau': 'Etat\nNouveau', 'Etat du bien\n1-5 ans': 'Etat du bien\n1-5 ans', 'Étage du bien\n2ème': 'Étage du bien\n2ème', 'Orientation\nNord': 'Orientation\nNord'}","{'Jardin': 'Jardin', 'Ascenseur': 'Ascenseur', 'Concierge': 'Concierge', 'Salon Marocain': 'Salon Marocain', 'Climatisation': 'Climatisation', 'Sécurité': 'Sécurité', 'Cuisine équipée': 'Cuisine équipée', 'Réfrigérateur': 'Réfrigérateur', 'Four': 'Four', 'Machine à laver': 'Machine à laver', 'Micro-ondes': 'Micro-ondes'}"
Prix à consulter,117 m²,3 Pièces,3 Chambres,2 Salles de bains,Les princesses à Casablanca,"Vente d'un bel appartement à Les princesses. Surface totale 117 m². Meublé
Affaire à saisir pour cet appartement à vendre. 3 pièces, 2 salles de bains, surface 117 m². 3 chambres. 18ème étage. Moins de 20
ans. Type de sol: Marbre. Propriété entièrement meublée.

Idéal si vous souhaitez acheter un appartement à Les princesses. Nombreux équipements dont climatisation. La résidence dispose également d'un service de conciergerie.

Programmez dès maintenant votre visite pour cet appartement d'exception à Casablanca. Cuisinière avec four. Ascenseur dans la résidence. Cuisine entièrement équipée.","{'Type de bien\nAppartement': 'Type de bien\nAppartement', 'Etat\nBon état': 'Etat\nBon état', 'Etat du bien\n10-20 ans': 'Etat du bien\n10-20 ans', 'Étage du bien\n18ème': 'Étage du bien\n18ème', 'Orientation\nSud': 'Orientation\nSud', 'Type du sol\nMarbre': 'Type du sol\nMarbre'}","{'Garage': 'Garage', 'Ascenseur': 'Ascenseur', 'Concierge': 'Concierge', 'Chambre rangement': 'Chambre rangement', 'Meublé': 'Meublé', 'Façade extérieure': 'Façade extérieure', 'Salon européen': 'Salon européen', 'Antenne parabolique': 'Antenne parabolique', 'Climatisation': 'Climatisation', 'Chauffage central': 'Chauffage central', 'Cuisine équipée': 'Cuisine équipée', 'Réfrigérateur': 'Réfrigérateur', 'Four': 'Four', 'Machine à laver': 'Machine à laver', 'Micro-ondes': 'Micro-ondes'}"
750 000 DH,173 m²,1 Salle de bain,,,Hay Hassani à Casablanca,"Garage Hay Hassani
Bonjour,
Je vends mon magasin situé à Hay Hassani Saad El Kheir d'une superficie de 173 m2.
Emplacement idéal pour tout commerce
Pour les personnes intéressées voici mon numéro","{'Type de bien\nLocal commercial': 'Type de bien\nLocal commercial', 'Etat\nBon état': 'Etat\nBon état', 'Type du sol\nCarrelage': 'Type du sol\nCarrelage'}",{'Garage': 'Garage'}
4 900 000 DH,234 m²,4 Salles de bains,,,Racine à Casablanca,"Beau bureau aménagé en duplex à vendre sur racine
Ref BV25 / BEAU BUREAU en DUPLEX à la vente entièrement AMÉNAGÉ, 234 M2, RACINE, 4 900 000 DH

Situé au cœur du quartier Racine, sur le bd d'Anfa ( très bien localisé), dans un Immeuble Exclusivement Professionnel ayant plusieurs avantages

Surface utile de 234 m2, répartie sur 2 niveaux (4 titres fusionnés)

AMÉNAGEMENT DE GRANDE QUALITÉ
EN TRÈS BON ÉTAT

2 plateaux de Bureaux TRÈS BIEN AGENCÉS, répartis comme suit :

7ème étage :
- Hall d'Accueil
- kitchenette ( Frigo et four )
- 3 grands Bureaux cloisonnés
- local technique pour serveur
- 2 toilettes

8ème étage :
- 2 grands Bureaux de Direction
- grande Salle de Réunion avec toilettes
- 2d toilette pour les autres bureaux
- 2 Salles d'archivage

Équipé de Luminaires, climatiseurs dans tous les espaces, système de Sécurité, capteur d'incendie, pointeuse ....

Les plus de ce Bureau :
- Belle Adresse
- Immeuble Exclusivement Professionnel avec Conciergerie
- 7ème et 8ème Seuls sur le Palier avec accès possible au 7ème et au 8ème étage
- 2 Ascenseurs
- Bureau d'angle très lumineux, beaucoup de clarté
- Bureau Très bien Aménagé, Agencé, Décoré et Cloisonné ( cloisons vitrées)
- Bureau prêt à l'emploi

A noter que Ce Bureau n'a pas de Parking , mais il est possible de Stationner dans un immeuble mitoyen qui dispose de nombreuses places de parking libres

Prix : 4 900 000 DH
Frais d’agence 2,5% HT

Agence UNIVERS FONCIER
(réf du bien BV25)","{'Type de bien\nBureau': 'Type de bien\nBureau', 'Etat\nBon état': 'Etat\nBon état'}","{'Ascenseur': 'Ascenseur', 'Concierge': 'Concierge', 'Sécurité': 'Sécurité'}"
,87 m²,3 Pièces,2 Chambres,1 Salle de bain,,,{},"{'Ascenseur': 'Ascenseur', 'Climatisation': 'Climatisation', 'Cuisine équipée': 'Cuisine équipée', 'Concierge': 'Concierge', 'Salon européen': 'Salon européen', 'Antenne parabolique': 'Antenne parabolique', 'Chauffage central': 'Chauffage central', 'Sécurité': 'Sécurité', 'Double vitrage': 'Double vitrage', 'Porte blindée': 'Porte blindée', 'Terrasse': 'Terrasse', 'Garage': 'Garage', 'Salon Marocain': 'Salon Marocain', 'Façade extérieure': 'Façade extérieure', 'Cheminée': 'Cheminée', 'Jardin': 'Jardin', 'Vue sur mer': 'Vue sur mer', 'Chambre rangement': 'Chambre rangement', 'Réfrigérateur': 'Réfrigérateur', 'Four': 'Four', 'Machine à laver': 'Machine à laver'}"
1 600 000 DH,122 m²,4 Pièces,3 Chambres,2 Salles de bains,Anfa Supérieur à Casablanca,"Appartement à vendre Palmier / Casablanca
Situé au quartier Palmiers à quelques minutes à pieds de Maarif, appartement 2/3 pièces traversant avec terrasse vue dégagée et aucun vis-à-vis, offrant une superficie de 122 M2. Dans une résidence de standing et calme, cet appartement est situé au 5ème et dernier étage avec ascenseur. Il comprend une entrée, un lumineux séjour et un très grand salon marocain triple exposition offrant une splendide vue dégagée sur les Palmiers. Une grande cuisine avec buanderie fermée et escalier permettant l'accès à la loge du gardien, une salle d'eau et une salle de bain. Deux belles chambres avec de nombreux rangements. Le calme et la luminosité sont les points forts de ce bien. Un bien rare sur le marché à visiter sans plus tarder!
Prix : 1.6 MMAD","{'Type de bien\nAppartement': 'Type de bien\nAppartement', 'Etat\nBon état': 'Etat\nBon état', 'Etat du bien\n1-5 ans': 'Etat du bien\n1-5 ans', 'Étage du bien\n5ème': 'Étage du bien\n5ème', 'Type du sol\nCarrelage': 'Type du sol\nCarrelage'}","{'Terrasse': 'Terrasse', 'Garage': 'Garage', 'Ascenseur': 'Ascenseur', 'Façade extérieure': 'Façade extérieure', 'Salon Marocain': 'Salon Marocain', 'Cuisine équipée': 'Cuisine équipée'}"
5 800 000 DH,220 m²,7 Pièces,3 Chambres,3 Salles de bains,Ain Diab à Casablanca,"Très bel appartement vide sur mer
Affaire à saisir pour cet appartement à vendre. Prix 5800000 DH. 7 pièces, 3 salles de bains, surface 214 m2 plus terasse. 3 chambres. 6ème étage. Moins de 5 ans. Revêtement: Marbre. Résidence sécurisée et porte blindée. Le bien dispose également d'une antenne parabolique et d'un beau salon marocain traditionnel.

Cet appartement est proposé à la vente à Ain Diab. Parfaitement équipé avec chauffage central et double vitrage. Vue imprenable sur la mer. Confort et sécurité avec service de conciergerie et climatisation.

Programmez dès maintenant votre visite pour cet appartement d'exception à Casablanca. Dispose d'une terrasse. Résidence avec ascenseur. Cuisine entièrement équipée. Salon contemporain.

Proche de toutes commodités: grande surface et écoles à 1.4 kilomètre, hôpitaux à 750 mètres, commerces à 2.1 kilomètres, transports en commun à 900 mètres, cafés et restaurants à 2.4 kilomètres, plage à 950 mètres.","{'Type de bien\nAppartement': 'Type de bien\nAppartement', 'Etat\nNouveau': 'Etat\nNouveau', 'Etat du bien\n1-5 ans': 'Etat du bien\n1-5 ans', 'Étage du bien\n3ème': 'Étage du bien\n3ème', 'Orientation\nSud': 'Orientation\nSud', 'Type du sol\nMarbre': 'Type du sol\nMarbre'}","{'Terrasse': 'Terrasse', 'Garage': 'Garage', 'Ascenseur': 'Ascenseur', 'Vue sur mer': 'Vue sur mer', 'Concierge': 'Concierge', 'Salon Marocain': 'Salon Marocain', 'Salon européen': 'Salon européen', 'Antenne parabolique': 'Antenne parabolique', 'Climatisation': 'Climatisation', 'Chauffage central': 'Chauffage central', 'Sécurité': 'Sécurité', 'Double vitrage': 'Double vitrage', 'Porte blindée': 'Porte blindée', 'Cuisine équipée': 'Cuisine équipée'}"
2 500 000 DH,160 m²,3 Pièces,1 Chambre,2 Salles de bains,Gauthier à Casablanca,"Très beau loft Gauthier
Opportunité unique pour cet appartement à vendre. Prix 2 500 000 DH. 3 pièces, 2 salles de bains, 160 m². 1 chambre. 2ème étage. Moins de 5 ans. Type de sol: Marbre. Bien meublé.

Cet appartement est proposé à la vente à Gauthier. Résidence sécurisée et porte blindée. Le bien dispose également d'une antenne parabolique. Bénéficiez du calme absolu avec fenêtres en double vitrage. Dispose du chauffage central.

Soyez le premier à visiter cet appartement en vente à Casablanca. Confort et sécurité avec service de conciergerie et climatisation. Salon contemporain. Cuisine équipée.","{'Type de bien\nAppartement': 'Type de bien\nAppartement', 'Etat\nBon état': 'Etat\nBon état', 'Etat du bien\n1-5 ans': 'Etat du bien\n1-5 ans', 'Étage du bien\n2ème': 'Étage du bien\n2ème', 'Orientation\nSud': 'Orientation\nSud', 'Type du sol\nMarbre': 'Type du sol\nMarbre'}","{'Garage': 'Garage', 'Ascenseur': 'Ascenseur', 'Concierge': 'Concierge', 'Meublé': 'Meublé', 'Façade extérieure': 'Façade extérieure', 'Salon européen': 'Salon européen', 'Antenne parabolique': 'Antenne parabolique', 'Climatisation': 'Climatisation', 'Chauffage central': 'Chauffage central', 'Sécurité': 'Sécurité', 'Double vitrage': 'Double vitrage', 'Porte blindée': 'Porte blindée', 'Cuisine équipée': 'Cuisine équipée'}"
Prix à consulter,80 m²,3 Pièces,2 Chambres,2 Salles de bains,Roches Noires à Casablanca,"Appartement a roche noir
80 m2 terrasse 10 mètres","{'Type de bien\nAppartement': 'Type de bien\nAppartement', 'Etat\nBon état': 'Etat\nBon état', 'Etat du bien\n5-10 ans': 'Etat du bien\n5-10 ans', 'Étage du bien\n15ème': 'Étage du bien\n15ème', 'Type du sol\nCarrelage': 'Type du sol\nCarrelage'}","{'Terrasse': 'Terrasse', 'Garage': 'Garage', 'Ascenseur': 'Ascenseur', 'Concierge': 'Concierge', 'Salon européen': 'Salon européen', 'Cuisine équipée': 'Cuisine équipée'}"
13 000 DH,132 m²,3 Pièces,2 Chambres,2 Salles de bains,Mers Sultan à Casablanca,"Superbe appartement à vendre à Mers Sultan. 3 pièces confortables. Ascenseur et stationnement.
Appartement idéal à la vente. Prix 13 000 DH. 3 pièces, 2 salles de bains, superficie 132 m². 2 chambres à coucher. 2ème étage. Bon état. Revêtement: Carrelage. Ascenseur et garage dans la résidence.

Cet appartement est en vente à Mers Sultan, Casablanca. Air conditionné.","{'Type de bien\nAppartement': 'Type de bien\nAppartement', 'Etat\nBon état': 'Etat\nBon état', 'Étage du bien\n2ème': 'Étage du bien\n2ème', 'Type du sol\nCarrelage': 'Type du sol\nCarrelage'}","{'Garage': 'Garage', 'Ascenseur': 'Ascenseur', 'Climatisation': 'Climatisation'}"
300 000 DH,20 m²,1 Salle de bain,,,Zone Industrielle Moulay Rachid à Casablanca,"Magasin a vendre
Magasin a vendre tit mllil bon emplacement","{'Type de bien\nLocal commercial': 'Type de bien\nLocal commercial', 'Etat\nBon état': 'Etat\nBon état'}",{}
1 950 000 DH,105 m²,4 Pièces,3 Chambres,2 Salles de bains,Les princesses à Casablanca,"Bel appartement à vendre au quartier les princesses Casablanca
Appartement à vendre à Casablanca, dans le quartier recherché des Princesses.
D'une superficie de 105 m²,

cet appartement dispose de 3 chambres, 2 salles de bains et un spacieux salon européen.
il offre un cadre contemporain avec des équipements modernes, dont la climatisation, un chauffage central et des fenêtres en double vitrage pour une tranquillité absolue. De plus, une magnifique terrasse vient embellir cet espace, offrant un lieu de détente idéal.
Profitez également d'un ascenseur et une place parking titrés dans la résidence sécurisée.
Contactez-nous dès maintenant pour organiser une visite.","{'Type de bien\nAppartement': 'Type de bien\nAppartement', 'Etat\nNouveau': 'Etat\nNouveau', ""Etat du bien\nMoins d'un an"": ""Etat du bien\nMoins d'un an"", 'Étage du bien\n6ème': 'Étage du bien\n6ème', 'Orientation\nSud': 'Orientation\nSud', 'Type du sol\nMarbre': 'Type du sol\nMarbre'}","{'Terrasse': 'Terrasse', 'Garage': 'Garage', 'Ascenseur': 'Ascenseur', 'Concierge': 'Concierge', 'Chambre rangement': 'Chambre rangement', 'Façade extérieure': 'Façade extérieure', 'Salon européen': 'Salon européen', 'Antenne parabolique': 'Antenne parabolique', 'Climatisation': 'Climatisation', 'Chauffage central': 'Chauffage central', 'Sécurité': 'Sécurité', 'Double vitrage': 'Double vitrage', 'Cuisine équipée': 'Cuisine équipée', 'Four': 'Four', 'Micro-ondes': 'Micro-ondes'}"
7 300 000 DH,300 m²,16 Pièces,9 Chambres,3 Salles de bains,Sidi Maarouf à Casablanca,"Villa R1 à vendre au quartier Les Orangers
Découvrez l'élégance et le confort absolu dans cette magnifique villa située dans le prestigieux quartier Les Orangers à Casablanca. Offrant un cadre de vie exceptionnel, cette propriété de rêve est un véritable joyau immobilier.

Caractéristiques :

Surface du terrain : 300 m²
Surface construite au sol : 178,40 m² sur 3 niveaux
Total de la surface construite : 534,44 m²

Désignation :

1. La Cave :

Grande cuisine moderne
Grand salon
Grande chambre
Petite chambre
Hall
WC
Jardin
Garage 2 places
Chambre pour concierge

2. Rez-de-Chaussée :

2 grands salons
1 grande chambre
Douche
WC

3. 1er Étage :

3 chambres
1 grande chambre parentale avec jacuzzi et douche
Dressing
1 douche à côté des chambres

4. Terrasse :

Très large avec une chambre construite

Extérieur :

Petit jardin à l'entrée de la villa

Emplacement :
Située dans le quartier résidentiel prisé des Orangers, cette villa bénéficie d'un emplacement privilégié, proche des commodités, écoles, et centres commerciaux.

Prix de Vente (négociable) :

Sans meubles : 7,3 millions de dirhams
Avec meubles : 7,5 millions de dirhams

Intéressé(e) ?
Contactez-nous dès maintenant sur Whatsapp pour plus d'informations et pour organiser une visite privée","{'Type de bien\nVilla': 'Type de bien\nVilla', 'Etat\nBon état': 'Etat\nBon état'}","{'Jardin': 'Jardin', 'Terrasse': 'Terrasse', 'Garage': 'Garage', 'Concierge': 'Concierge', 'Chambre rangement': 'Chambre rangement', 'Meublé': 'Meublé'}"
12 000 000 DH,403 m²,8 Pièces,5 Chambres,3 Salles de bains,CIL (Hay Salam) à Casablanca,"Villa commerciale 403m² à vendre sur Grand Boulevard
Votre espace commercial de rêve vous attend ! Cette villa de 403m² est idéale pour un showroom ou un siège d'entreprise. Située sur le prestigieux Grand Boulevard de Casablanca, elle offre une visibilité exceptionnelle et est à proximité de toutes les commodités. Faites de votre entreprise un succès, contactez-nous dès aujourd'hui !","{'Type de bien\nVilla': 'Type de bien\nVilla', 'Etat\nBon état': 'Etat\nBon état', 'Type du sol\nMarbre': 'Type du sol\nMarbre'}","{'Terrasse': 'Terrasse', 'Garage': 'Garage', 'Ascenseur': 'Ascenseur', 'Concierge': 'Concierge', 'Climatisation': 'Climatisation', 'Sécurité': 'Sécurité'}"
Prix à consulter,150 m²,4 Pièces,3 Chambres,2 Salles de bains,Maârif à Casablanca,"Vente d'un bel appartement à Maârif. Surface totale 150 m². Ascenseur et terrasse.
Affaire à saisir pour cet appartement à vendre. 4 pièces, 2 salles de bains, surface 150 m². 3 chambres à coucher. Bon état.

Cet appartement est proposé à la vente à Maârif. Vous profiterez d'une belle terrasse. Un ascenseur et un garage sont également à votre disposition. Prestation de conciergerie.

Programmez dès maintenant votre visite pour cet appartement d'exception à Casablanca.","{'Type de bien\nAppartement': 'Type de bien\nAppartement', 'Etat\nBon état': 'Etat\nBon état'}","{'Terrasse': 'Terrasse', 'Garage': 'Garage', 'Ascenseur': 'Ascenseur', 'Concierge': 'Concierge', 'Façade extérieure': 'Façade extérieure'}"
900 000 DH,85 m²,2 Pièces,3 Chambres,1 Salle de bain,Sidi El Khadir à Casablanca,"Appartement à vendre 85 m 2 Chambres Hay Hassani
Charmant appartement de 85 m² composé de 2 chambres, à un prix de 900 000 MAD.","{'Type de bien\nAppartement': 'Type de bien\nAppartement', 'Etat\nBon état': 'Etat\nBon état', 'Etat du bien\n5-10 ans': 'Etat du bien\n5-10 ans', 'Étage du bien\n2ème': 'Étage du bien\n2ème', 'Orientation\nOuest': 'Orientation\nOuest', 'Type du sol\nCarrelage': 'Type du sol\nCarrelage'}",{'Cuisine équipée': 'Cuisine équipée'}
