price,surface,piece,rooms,bathroom,address,description,more_features_1_dict,more_features_2_dict
2 700 000 DH,174 m²,5 Pièces,3 Chambres,2 Salles de bains,Les Hôpitaux à Casablanca,"Spacieux Appartement en Vente Q. Les Hopitaux
Une belle affaire un appartement ensoleillé sans vis àvis d'une superficie de 174m² habitable au 4ème étage d'un immeuble très bien entretenu avec caméra et surveiller 24/24, dispose de deux ascenseurs, composé d'un grand salon, un séjour, un coin cheminée, une spacieuse cuisine équipée avec buanderie, une toilette de réception, trois chambres dont une chambre parentale avec balcon, dressing et salle de bain, une salle de bain avec douche en commune avec les deux chambres placard de rangement pour chaque chambre, une place numéroté au garage et une place au terrasse.

Idéal si vous souhaitez acheter un appartement au quartier Les Hôpitaux, proche de toute commodité.Sécurité maximale avec système de surveillance.

Contactez-nous pour visiter cet appartement à vendre, où pour plus d'information.
Prix de vente 2 700 000dhs","{'Type de bien\nAppartement': 'Type de bien\nAppartement', 'Etat\nBon état': 'Etat\nBon état', 'Etat du bien\n5-10 ans': 'Etat du bien\n5-10 ans', 'Étage du bien\n4ème': 'Étage du bien\n4ème', 'Orientation\nSud': 'Orientation\nSud', 'Type du sol\nMarbre': 'Type du sol\nMarbre'}","{'Terrasse': 'Terrasse', 'Garage': 'Garage', 'Ascenseur': 'Ascenseur', 'Concierge': 'Concierge', 'Façade extérieure': 'Façade extérieure', 'Salon Marocain': 'Salon Marocain', 'Salon européen': 'Salon européen', 'Antenne parabolique': 'Antenne parabolique', 'Cheminée': 'Cheminée', 'Climatisation': 'Climatisation', 'Sécurité': 'Sécurité', 'Double vitrage': 'Double vitrage', 'Porte blindée': 'Porte blindée', 'Cuisine équipée': 'Cuisine équipée'}"
2 350 000 DH,186 m²,4 Pièces,3 Chambres,2 Salles de bains,Val Fleury à Casablanca,"Vente d'un bel appartement à Val fleurie
Ne laissez pas passer cet appartement à vendre au 2ème étage d'un immeuble très bien entretenu avec ascenseur et concierge, proche de toute commodité, d'une superficie de 186m² dont 30m² de parking, Prix de vente 2 350 000 DH. Composé pièces, 2 salles de bains, 186 m². De 3 chambres dont une suite parentale avec salle de bain et un grand placard, une sallede bain en communepour les deux chambres, triple salon un coin cheminée, une cuisine, et 2 palces titrées au garage.
Pour plus d'informations n'hésitez pas à nous contacter.","{'Type de bien\nAppartement': 'Type de bien\nAppartement', 'Etat\nBon état': 'Etat\nBon état', 'Etat du bien\n5-10 ans': 'Etat du bien\n5-10 ans', 'Étage du bien\n2ème': 'Étage du bien\n2ème', 'Orientation\nSud': 'Orientation\nSud', 'Type du sol\nMarbre': 'Type du sol\nMarbre'}","{'Garage': 'Garage', 'Ascenseur': 'Ascenseur', 'Concierge': 'Concierge', 'Chambre rangement': 'Chambre rangement', 'Façade extérieure': 'Façade extérieure', 'Salon Marocain': 'Salon Marocain', 'Salon européen': 'Salon européen', 'Antenne parabolique': 'Antenne parabolique', 'Cheminée': 'Cheminée', 'Climatisation': 'Climatisation', 'Sécurité': 'Sécurité', 'Double vitrage': 'Double vitrage', 'Porte blindée': 'Porte blindée', 'Cuisine équipée': 'Cuisine équipée'}"
6 600 000 DH,500 m²,6 Pièces,4 Chambres,4 Salles de bains,Polo à Casablanca,"Bel appartement à vendre à Polo. 4 chambres agréables. Places de stationnement et terrasse
Ne laissez pas passer cet villa à vendre. Prix 6 600 000 DH. 6 pièces, 4 salles de bains, surface 500 m². 4 chambres. Bon état. Villa parfaitement équipée avec un parking. Vous profiterez également d'un jardin et d'une belle terrasse.

Cet appartement est en vente à Polo. Bénéficiez du calme absolu avec fenêtres en double vitrage. Porte d'entrée blindée. Profitez du confort de la cheminée et de la climatisation.

Contactez-nous pour visiter cet appartement à vendre à Casablanca. Four encastré. Cuisine bien équipée.","{'Type de bien\nVilla': 'Type de bien\nVilla', 'Etat\nBon état': 'Etat\nBon état'}","{'Jardin': 'Jardin', 'Terrasse': 'Terrasse', 'Garage': 'Garage', 'Chambre rangement': 'Chambre rangement', 'Cheminée': 'Cheminée', 'Climatisation': 'Climatisation', 'Double vitrage': 'Double vitrage', 'Porte blindée': 'Porte blindée', 'Cuisine équipée': 'Cuisine équipée', 'Four': 'Four'}"
Prix à consulter,676 m²,,,,Hermitage à Casablanca,"Vente terrain constructible Hermitage
-Terrain zone immeuble R3
-Superficie : 676 M²
-Façade : 18 mètres
-Orientation : Sud-Est
-Prix : 16000 dhs/M²",{'Type de bien\nTerrain': 'Type de bien\nTerrain'},{}
2 800 000 DH,249 m²,7 Pièces,4 Chambres,3 Salles de bains,Hay Zobir à Casablanca,"Villa à vendre
villa d'une superficie de 249 m² avec un superficie construite de130 m². Composée de trois salons au rez de chaussée et 4 pièces au 1er étage dont une suite parentale et une grande terrasse avec un débarra. Petit jardin et parking au façade d'avant et une grande jardin au façade de derrière. Près de toutes les commodités de la vie marché, mosquée, transports....","{'Type de bien\nVilla': 'Type de bien\nVilla', 'Etat\nBon état': 'Etat\nBon état', 'Etat du bien\n5-10 ans': 'Etat du bien\n5-10 ans', 'Orientation\nSud': 'Orientation\nSud', 'Type du sol\nMarbre': 'Type du sol\nMarbre'}","{'Jardin': 'Jardin', 'Terrasse': 'Terrasse', 'Garage': 'Garage', 'Chambre rangement': 'Chambre rangement', 'Salon Marocain': 'Salon Marocain', 'Salon européen': 'Salon européen', 'Antenne parabolique': 'Antenne parabolique', 'Cheminée': 'Cheminée', 'Climatisation': 'Climatisation', 'Sécurité': 'Sécurité', 'Cuisine équipée': 'Cuisine équipée'}"
2 100 000 DH,147 m²,5 Pièces,3 Chambres,2 Salles de bains,Gauthier à Casablanca,"Particulier vend appartement de 147 m² à gauthier
Vous rêvez d'un appartement exceptionnel, sans vis-à-vis, au cœur du très prisé quartier de Gauthier ?

Cette opportunité unique vous attend au 6ème étage ( un appartement par etage ) d'un immeuble de 7 étages avec ascenseur.

Ce bel appartement de 147 m² se compose de :

- Un double salon  spacieux et lumineux équipé d une cheminée et d d un parquet massif a l anglaise, créant une atmosphère accueillante.
- Une grande cuisine équipée avec coin salle à manger
- 3 chambres à coucher, dont une suite parentale
- 2 salle de bain bien aménagée une avec douche et l autre avec baignoire
- Un lave main invitée


Ne ratez pas l'occasion d'explorer cette propriété exceptionnelle située au cœur de l'un des quartiers les plus convoités de Gauthier.

Pour plus d'informations ou pour planifier une visite, veuillez me contacter","{'Type de bien\nAppartement': 'Type de bien\nAppartement', 'Etat\nBon état': 'Etat\nBon état', 'Etat du bien\n20-30 ans': 'Etat du bien\n20-30 ans', 'Étage du bien\n6ème': 'Étage du bien\n6ème', 'Orientation\nSud': 'Orientation\nSud', 'Type du sol\nParquet': 'Type du sol\nParquet'}","{'Ascenseur': 'Ascenseur', 'Concierge': 'Concierge', 'Salon Marocain': 'Salon Marocain', 'Salon européen': 'Salon européen', 'Cheminée': 'Cheminée', 'Sécurité': 'Sécurité', 'Cuisine équipée': 'Cuisine équipée'}"
3 850 000 DH,111 m²,2 Pièces,2 Chambres,2 Salles de bains,Ain Diab à Casablanca,"Superbe appartement à vendre à Ain Diab. Surface de 111 m². Anfa place
Découvrez le summum du luxe avec cet appartement exceptionnel de 111 m² à Anfa Place, en vente au rez-de-chaussée. Baigné de lumière naturelle, ce bijou immobilier offre une expérience unique, entouré de jardins luxuriants, avec un accès privilégié à l'eau, au cœur de la résidence la plus prisée à Ain Diab, Casablanca.

Cet appartement de luxe, dans un état impeccable, séduit par son orientation idéale au sud-est, assurant une luminosité inégalée. Doté de 2 chambres somptueuses, chacune avec sa salle de bains privative, vous pourrez vous détendre dans le jacuzzi de marque Jacob Delafon. Le grand salon s'ouvre sur une belle terrasse offrant une vue imprenable sans vis-à-vis.

L'équipement haut de gamme inclut une cuisine signée Bosch, équipée d'appareils électroménagers dernier cri tels que plaque électrique, réfrigérateur, congélateur, micro-ondes, four, lave-vaisselle, sèche-linge et machine à laver. Une place de parking titrée dans un espace sécurisé complète ce cadre de vie exclusif.

Profitez d'une vie de luxe dans cette résidence prestigieuse, à proximité de l'hôtel de renom Four Seasons et d'un centre commercial proposant une gamme complète de commodités. Un cadre idéal où élégance et sécurité se rencontrent pour créer un chez-soi d'exception.","{'Type de bien\nAppartement': 'Type de bien\nAppartement', 'Etat\nBon état': 'Etat\nBon état', 'Etat du bien\n5-10 ans': 'Etat du bien\n5-10 ans', 'Orientation\nSud': 'Orientation\nSud', 'Type du sol\nMarbre': 'Type du sol\nMarbre'}","{'Jardin': 'Jardin', 'Terrasse': 'Terrasse', 'Garage': 'Garage', 'Ascenseur': 'Ascenseur', 'Vue sur mer': 'Vue sur mer', 'Concierge': 'Concierge', 'Façade extérieure': 'Façade extérieure', 'Salon européen': 'Salon européen', 'Antenne parabolique': 'Antenne parabolique', 'Climatisation': 'Climatisation', 'Chauffage central': 'Chauffage central', 'Sécurité': 'Sécurité', 'Réfrigérateur': 'Réfrigérateur', 'Four': 'Four', 'Machine à laver': 'Machine à laver', 'Micro-ondes': 'Micro-ondes'}"
1 600 000 DH,119 m²,2 Chambres,2 Salles de bains,,Les princesses à Casablanca,"Bel appartement à vendre à Les princesses. 2 chambres. Avec ascenseur.
PRINCESSES Bel appartement traversant de 103m2 habitable dans une résidence bien entretenue. Il se compose d'un hall pouvant servir de salle à manger, un salon spacieux et lumineux, une cuisine bien aménagée, deux chambres à coucher dont une suite parentale et une salle de bain pour la deuxième chambre. Appartement très lumineux sans vis-à-vis Ascenseur 1 place titrée ainsi qu'un box en sous-sol de ...PRINCESSES
Bel appartement traversant de 103m2 habitable dans une résidence bien entretenue.
Il se compose d&#8217;un hall pouvant servir de salle à manger, un salon spacieux et lumineux, une cuisine bien aménagée, deux chambres à coucher dont une suite parentale et une salle de bain pour la deuxième chambre.
Appartement très lumineux sans vis-à-vis
Ascenseur
1 place titrée ainsi qu&#8217;un box en sous-sol de 16m2 au total",{'Type de bien\nAppartement': 'Type de bien\nAppartement'},{'Ascenseur': 'Ascenseur'}
2 100 000 DH,72 m²,4 Pièces,5 Chambres,3 Salles de bains,Dar Touzani à Casablanca,"New maison
salut maisin pour grand famille","{'Type de bien\nVilla': 'Type de bien\nVilla', 'Etat\nNouveau': 'Etat\nNouveau'}","{'Terrasse': 'Terrasse', 'Garage': 'Garage'}"
23 500 000 DH,804 m²,6 Pièces,4 Chambres,3 Salles de bains,Anfa Supérieur à Casablanca,"Vente villa moderne anfa supérieur
Maison faite par un architecte marocain très connue sur un terrain de 805 m carré et 650 de construit sur trois niveaux.
5 chambres / piscine et cinéma.
Chauffage & Clim centralisée/ avec split et chauffage solaire...
Réf : villaav117","{'Type de bien\nVilla': 'Type de bien\nVilla', 'Etat\nBon état': 'Etat\nBon état', 'Etat du bien\n5-10 ans': 'Etat du bien\n5-10 ans', 'Type du sol\nMarbre': 'Type du sol\nMarbre'}","{'Jardin': 'Jardin', 'Terrasse': 'Terrasse', 'Garage': 'Garage', 'Piscine': 'Piscine', 'Chambre rangement': 'Chambre rangement', 'Salon Marocain': 'Salon Marocain', 'Salon européen': 'Salon européen', 'Antenne parabolique': 'Antenne parabolique', 'Cheminée': 'Cheminée', 'Chauffage central': 'Chauffage central', 'Sécurité': 'Sécurité', 'Porte blindée': 'Porte blindée', 'Cuisine équipée': 'Cuisine équipée', 'Réfrigérateur': 'Réfrigérateur', 'Four': 'Four', 'Machine à laver': 'Machine à laver', 'Micro-ondes': 'Micro-ondes'}"
Prix à consulter,700 m²,5 Pièces,5 Chambres,5 Salles de bains,Hay Chrifa à Casablanca,"Villa à Hay chrifa garage commercial 100 m2
Villa à vendre à Hay chrifa avec un magasin commercial de plus de 100 m2.
- À 200 mètres de Bd. el qods.
- Surface plancher : 700 m2 sur 3 étages.
- Surface terrain : 306 m2.
- Avec jardin, terrasse et garage pour voiture.","{'Type de bien\nVilla': 'Type de bien\nVilla', 'Etat\nBon état': 'Etat\nBon état'}","{'Terrasse': 'Terrasse', 'Garage': 'Garage'}"
650 000 DH,80 m²,6 Pièces,2 Chambres,1 Salle de bain,Hay Mohammadi à Casablanca,"Appartement à l'achat à Hay Mohammadi. 6 grandes pièces
Faites une belle affaire en achetant cet appartement. Prix 650 000 DH. 2 chambres, 1 salle de bains, surface 80 m². 6 pièces. 3ème étage. Moins de 10 ans.

Cet appartement est proposé à la vente à Hay Mohammadi, Casablanca.","{'Type de bien\nAppartement': 'Type de bien\nAppartement', 'Etat\nBon état': 'Etat\nBon état', 'Etat du bien\n5-10 ans': 'Etat du bien\n5-10 ans', 'Étage du bien\n3ème': 'Étage du bien\n3ème'}",{}
Prix à consulter,70 m²,3 Pièces,2 Chambres,1 Salle de bain,Bourgogne Ouest à Casablanca,"Appartement avendre a bourgogne
Bel appartement a vendre à bourgogne en 1er etage qui se compose de 2 chambres 1 salon 1 cuisine et 1 douche.dans un quartier calm proche de la mosquee hassan 2 et du park sans vis a vis.","{'Type de bien\nAppartement': 'Type de bien\nAppartement', 'Etat\nBon état': 'Etat\nBon état', 'Etat du bien\n10-20 ans': 'Etat du bien\n10-20 ans', 'Étage du bien\n1er': 'Étage du bien\n1er', 'Orientation\nNord': 'Orientation\nNord'}","{'Vue sur mer': 'Vue sur mer', 'Cuisine équipée': 'Cuisine équipée'}"
2 300 000 DH,176 m²,4 Pièces,3 Chambres,2 Salles de bains,Les Hôpitaux à Casablanca,"Appartement à vendre à Les Hôpitaux. 3 chambres. Meublé
Opportunité unique pour cet appartement à vendre. Prix 2 300 000 DH. 3 chambres, 2 salles de bains, surface 176 m². 4 pièces. 1er étage. Moins de 20 ans. Type de sol: Marbre. Bien meublé.

Cet appartement est proposé à la vente à Les Hôpitaux. Résidence sécurisée et antenne parabolique. Le bien dispose également d'un beau salon marocain traditionnel. Confort et sécurité avec service de conciergerie, cheminée et climatisation.

Contactez-nous si vous êtes intéressé par cet appartement à Casablanca. Profitez d'une belle terrasse. Dispose également d'un ascenseur. Salon contemporain. Tranquillité garantie avec fenêtres en double vitrage.","{'Type de bien\nAppartement': 'Type de bien\nAppartement', 'Etat\nBon état': 'Etat\nBon état', 'Etat du bien\n10-20 ans': 'Etat du bien\n10-20 ans', 'Étage du bien\n1er': 'Étage du bien\n1er', 'Orientation\nSud': 'Orientation\nSud', 'Type du sol\nMarbre': 'Type du sol\nMarbre'}","{'Terrasse': 'Terrasse', 'Garage': 'Garage', 'Ascenseur': 'Ascenseur', 'Concierge': 'Concierge', 'Meublé': 'Meublé', 'Façade extérieure': 'Façade extérieure', 'Salon Marocain': 'Salon Marocain', 'Salon européen': 'Salon européen', 'Antenne parabolique': 'Antenne parabolique', 'Cheminée': 'Cheminée', 'Climatisation': 'Climatisation', 'Sécurité': 'Sécurité', 'Double vitrage': 'Double vitrage', 'Cuisine équipée': 'Cuisine équipée', 'Réfrigérateur': 'Réfrigérateur', 'Four': 'Four', 'Machine à laver': 'Machine à laver', 'Micro-ondes': 'Micro-ondes'}"
1 050 000 DH,96 m²,3 Pièces,2 Chambres,2 Salles de bains,Belvédère à Casablanca,"Magnifique Appartement à vendre à Belvédère. 2 chambres agréables
Découvrez ce bel appartement à vendre. Prix 1 050 000 DH. Salon suite parentale, 1 chambre, salle d'eau invités, superficie 96 m² 3m garage.
Bien Ensoleillé sans vis à vis

Cet appartement est proposé à la vente à Belvédère, Casablanca. Avec ascenseur.
Intermédiaire s'abstenir","{'Type de bien\nAppartement': 'Type de bien\nAppartement', 'Etat\nBon état': 'Etat\nBon état', 'Etat du bien\n1-5 ans': 'Etat du bien\n1-5 ans', 'Type du sol\nMarbre': 'Type du sol\nMarbre'}","{'Garage': 'Garage', 'Ascenseur': 'Ascenseur', 'Sécurité': 'Sécurité'}"
1 500 000 DH,168 m²,3 Pièces,3 Chambres,1 Salle de bain,Les Hôpitaux à Casablanca,"Appartement 3 chambres de 168m2
Appartement sur 2 Mars calme et bien situé.
Me contacter pour plus d'informations.","{'Type de bien\nAppartement': 'Type de bien\nAppartement', 'Etat\nBon état': 'Etat\nBon état', 'Etat du bien\n20-30 ans': 'Etat du bien\n20-30 ans', 'Étage du bien\n1er': 'Étage du bien\n1er'}","{'Terrasse': 'Terrasse', 'Ascenseur': 'Ascenseur', 'Concierge': 'Concierge', 'Sécurité': 'Sécurité', 'Cuisine équipée': 'Cuisine équipée'}"
2 300 000 DH,136 m²,4 Pièces,3 Chambres,2 Salles de bains,Bourgogne Ouest à Casablanca,"Bel appartement à Bourgogne
Appartement entièrement rénové,bien ensoleillé,situé à angle boulevard tan tan à 5 min à pied de la corniche Casablanca.
Composé de : grand salon Ave cheminée,3 chambres / une suite parentale avec salle de bain et 2 chambres SDB,cuisine bien équipée,une grande terrasse,un box et une place au parking.
Superficie : 136 m2 ( 125 m habitable","{'Type de bien\nAppartement': 'Type de bien\nAppartement', 'Etat\nBon état': 'Etat\nBon état'}","{'Jardin': 'Jardin', 'Terrasse': 'Terrasse', 'Garage': 'Garage', 'Ascenseur': 'Ascenseur', 'Concierge': 'Concierge', 'Chambre rangement': 'Chambre rangement', 'Façade extérieure': 'Façade extérieure', 'Salon européen': 'Salon européen', 'Antenne parabolique': 'Antenne parabolique', 'Cheminée': 'Cheminée', 'Climatisation': 'Climatisation', 'Cuisine équipée': 'Cuisine équipée', 'Four': 'Four', 'Machine à laver': 'Machine à laver', 'Micro-ondes': 'Micro-ondes'}"
3 800 000 DH,216 m²,5 Pièces,3 Chambres,3 Salles de bains,Racine à Casablanca,"Joli appartement sans vis à vis ensoleillé à vendre sur racine
L’agence immobilière COBELLO vous propose à la vente ce joli appartement sans vis-à-vis très bien ensoleillé situé au 3eme étage d’un immeuble bien situé sur racine . D’une superficie de 216 m2 et de compose :
-Double salon avec coin cheminée et terrasse
-Suite parentale avec salle de bain et dressing
-Salle d’eau pour invités
-2 chambres à coucher
-Salle de bain
-Cuisine Indépendante
-2 terrasses
-Place au garage titrée

L’appartement est disponible immédiatement.

- Hon. agence:
Vente: 2.5% TVA (20%)
Location : 1 mois de loyer.","{'Type de bien\nAppartement': 'Type de bien\nAppartement', 'Etat\nBon état': 'Etat\nBon état', 'Etat du bien\n10-20 ans': 'Etat du bien\n10-20 ans', 'Étage du bien\n3ème': 'Étage du bien\n3ème'}","{'Terrasse': 'Terrasse', 'Garage': 'Garage', 'Ascenseur': 'Ascenseur', 'Concierge': 'Concierge', 'Façade extérieure': 'Façade extérieure', 'Cheminée': 'Cheminée', 'Climatisation': 'Climatisation', 'Chauffage central': 'Chauffage central', 'Double vitrage': 'Double vitrage'}"
1 000 000 DH,89 m²,2 Pièces,2 Chambres,1 Salle de bain,Bourgogne Est à Casablanca,"Apparemment avec cuisine américaine équipée
Cuisine américaine
Pas de travaux à prévoir
Proche de toute commodité","{'Type de bien\nAppartement': 'Type de bien\nAppartement', 'Etat\nBon état': 'Etat\nBon état', 'Etat du bien\n10-20 ans': 'Etat du bien\n10-20 ans', 'Étage du bien\n5ème': 'Étage du bien\n5ème', 'Orientation\nOuest': 'Orientation\nOuest', 'Type du sol\nCarrelage': 'Type du sol\nCarrelage'}","{'Terrasse': 'Terrasse', 'Garage': 'Garage', 'Ascenseur': 'Ascenseur', 'Salon Marocain': 'Salon Marocain', 'Salon européen': 'Salon européen', 'Antenne parabolique': 'Antenne parabolique', 'Sécurité': 'Sécurité', 'Porte blindée': 'Porte blindée', 'Cuisine équipée': 'Cuisine équipée', 'Réfrigérateur': 'Réfrigérateur', 'Four': 'Four', 'Machine à laver': 'Machine à laver', 'Micro-ondes': 'Micro-ondes'}"
Prix à consulter,85 m²,1 Pièce,2 Chambres,2 Salles de bains,Belvédère à Casablanca,"Appartement a Belvedere
Nous mettons en vente un appart 85m, au 7 eme etg sans vis a vis, dans un endroit calme disposant de 2ch salon 2sdb debarras grande terrasse, salon place au parking non titre.
Proche de toutes commodités (carrefour, marjane, bim, tachefine centre, ecole, station tramway a 3 min a pied)

Motif de vente : voyage
Prix du m2: 12000 dh/m2","{'Type de bien\nAppartement': 'Type de bien\nAppartement', 'Etat\nBon état': 'Etat\nBon état', 'Etat du bien\n5-10 ans': 'Etat du bien\n5-10 ans', 'Étage du bien\n7ème': 'Étage du bien\n7ème', 'Type du sol\nMarbre': 'Type du sol\nMarbre'}","{'Terrasse': 'Terrasse', 'Garage': 'Garage', 'Ascenseur': 'Ascenseur', 'Chambre rangement': 'Chambre rangement', 'Climatisation': 'Climatisation', 'Four': 'Four'}"
2 200 000 DH,120 m²,4 Pièces,3 Chambres,2 Salles de bains,Anfa à Casablanca,"Bel appartement à vendre à val d’Anfa
Très joli appartement à vendre à Val d'Anfa

Découvrez cet appartement idéalement situé à Val d'Anfa, proche des écoles Léon l'Africain et Massignon, ainsi que de toutes les commodités.

#### Caractéristiques principales :
- **Chambres** : 3 chambres ️
- **Salles de bains** : 2 salles de bain
- **Cuisine** : Cuisine équipée ️
- **Salon** : Salon spacieux ️
- **Équipements** : Ascenseur , garage
- **Superficie** : 120 m²
- **Disposition** : 2 appartements par étage, situé au 3ème étage

**Prix** : 2,200,000 DH


**Annonce : PR57661**
**Référence : 097/770**","{'Type de bien\nAppartement': 'Type de bien\nAppartement', 'Etat\nBon état': 'Etat\nBon état', 'Étage du bien\n3ème': 'Étage du bien\n3ème'}","{'Terrasse': 'Terrasse', 'Garage': 'Garage', 'Ascenseur': 'Ascenseur', 'Concierge': 'Concierge', 'Cuisine équipée': 'Cuisine équipée'}"
890 000 DH,43 m²,2 Pièces,1 Chambre,1 Salle de bain,Maârif à Casablanca,"Appartement en vente à abdelmomen
**Charmant Studio Ensoleillé à Vendre - Abdelmoumen**

Nous mettons en vente un charmant studio ensoleillé de 43 m² situé dans le quartier Abdelmoumen. Il comprend un salon, une chambre, une cuisine, une salle de bain, ainsi qu'un ascenseur et un garage pour votre confort.

Prix Sacrifié : 890 000 DH

Pour plus d'informations, contactez-nous
Annonce : PR66663
Référence : 176/324","{'Type de bien\nAppartement': 'Type de bien\nAppartement', 'Etat\nBon état': 'Etat\nBon état', 'Étage du bien\n4ème': 'Étage du bien\n4ème'}","{'Terrasse': 'Terrasse', 'Garage': 'Garage', 'Ascenseur': 'Ascenseur', 'Concierge': 'Concierge', 'Cuisine équipée': 'Cuisine équipée'}"
3 400 000 DH,193 m²,5 Pièces,4 Chambres,3 Salles de bains,Racine à Casablanca,"Vente d'un bel appartement à Racine
Appartement refait à neuf de 193m² dont 168m² habitable et 25m² de parking et terrasse.

Il se compose de:
- Double salon, traversant avec lave main invité.
- Une suite parentale avec sdb et un grand dressing.
- deux chambres avec salle de bain partagée
- Grande cuisine équipée ouverte sur un espace salle à manger.
- Chambre de service avec sa sdb.
- Appartement équipé de domotique intelligente (serrure électronique, et interrupteur volets commandables a distance via Google home/Alexa) et d'un système de vidéo surveillance
Place de parking titrée.



Contactez-nous si vous êtes intéressé par cet appartement à Casablanca. Four encastré.","{'Type de bien\nAppartement': 'Type de bien\nAppartement', 'Etat\nBon état': 'Etat\nBon état', 'Étage du bien\n4ème': 'Étage du bien\n4ème'}","{'Terrasse': 'Terrasse', 'Garage': 'Garage', 'Ascenseur': 'Ascenseur', 'Concierge': 'Concierge', 'Façade extérieure': 'Façade extérieure', 'Cuisine équipée': 'Cuisine équipée', 'Four': 'Four'}"
1 485 000 DH,110 m²,3 Pièces,2 Chambres,1 Salle de bain,Palmier à Casablanca,"Vente d'un bel appartement à Palmier. Surface totale 110 m². Avec ascenseur et terrasse
Opportunité unique pour cet appartement à vendre. Prix 1 540 000 DH. 2 chambres, 1 salle de bains, surface 110 m². 4ème étage. Résidence équipée d'un ascenseur. Vous profiterez également d'une belle terrasse.

Cet appartement est en vente à Palmier, Casablanca. Cuisine bien équipée.","{'Type de bien\nAppartement': 'Type de bien\nAppartement', 'Etat\nBon état': 'Etat\nBon état', 'Étage du bien\n4ème': 'Étage du bien\n4ème'}","{'Terrasse': 'Terrasse', 'Ascenseur': 'Ascenseur', 'Façade extérieure': 'Façade extérieure', 'Cuisine équipée': 'Cuisine équipée'}"
1 080 000 DH,110 m²,5 Pièces,2 Chambres,2 Salles de bains,La Gironde à Casablanca,"Appartement neuf à vendre
Découvrez ce magnifique appartement de 110m² situé dans le quartier très prisé de La Gironde à Casablanca. Ce bien immobilier neuf se trouve au 6ème étage d'une résidence de 7 étages. La propriété comprend 2 chambres, 1 suite parentale, 2 salles de bains, un balcon offrant une vue imprenable, et une place de parking.","{'Type de bien\nAppartement': 'Type de bien\nAppartement', 'Etat\nNouveau': 'Etat\nNouveau', 'Etat du bien\n10-20 ans': 'Etat du bien\n10-20 ans', 'Étage du bien\n6ème': 'Étage du bien\n6ème', 'Orientation\nOuest': 'Orientation\nOuest', 'Type du sol\nCarrelage': 'Type du sol\nCarrelage'}","{'Terrasse': 'Terrasse', 'Garage': 'Garage', 'Ascenseur': 'Ascenseur', 'Concierge': 'Concierge', 'Façade extérieure': 'Façade extérieure', 'Cuisine équipée': 'Cuisine équipée', 'Réfrigérateur': 'Réfrigérateur', 'Four': 'Four'}"
